{
  "schema_version": "repository-audit-profile/v1",
  "case_id": "swe-agent",
  "repository": {
    "name": "SWE-agent",
    "url": "https://github.com/SWE-agent/SWE-agent",
    "branch": "main",
    "commit": "3ea751c087f32b16e039a2233dd6eefecef325d5",
    "license": {
      "spdx": "MIT",
      "path": "LICENSE",
      "blob_sha": "e702436e21844c5c519de31ab68277a6d3b427d9"
    }
  },
  "scope": {
    "include": [
      "sweagent/agent/**",
      "sweagent/environment/**",
      "sweagent/tools/**",
      "trajectories/**",
      "tests/test_agent.py",
      "tests/test_tools_command_parsing.py",
      "tests/test_data/trajectories/**"
    ],
    "exclude": [
      "docs/**",
      "benchmark/**",
      "examples/**"
    ],
    "prohibited": [
      ".git/**"
    ],
    "extensions": [
      ".json",
      ".md",
      ".py",
      ".traj",
      ".yaml",
      ".yml"
    ],
    "max_file_bytes": 524288
  },
  "objectives": [
    {
      "title": "Agent loop evidence is traceable",
      "required_categories": [
        "agent",
        "tool",
        "trajectory",
        "verification"
      ],
      "pass_claim": "The scoped checkout contains static Agent, tool, trajectory, and verification evidence.",
      "unknown_claim": "The scoped checkout does not statically prove every Agent-loop stage.",
      "impact": {
        "level": "high"
      },
      "recommendation": "Bind completion claims to an explicit trajectory and verification artifact.",
      "localization": {
        "zh-CN": {
          "title": "Agent 循环证据可追溯",
          "pass_claim": "有界审查范围内存在可定位的 Agent、工具、执行轨迹与验证证据。",
          "unknown_claim": "有界审查范围不足以静态证明 Agent 循环的每个阶段。",
          "recommendation": "将每项完成声明明确关联到对应的执行轨迹和验证产物。"
        }
      }
    },
    {
      "title": "Tool interaction controls are visible",
      "required_categories": [
        "tool",
        "permission",
        "recovery"
      ],
      "pass_claim": "The scoped checkout exposes static tool, permission, and failure-handling evidence.",
      "unknown_claim": "The scoped checkout does not statically prove all tool-governance controls.",
      "impact": {
        "level": "high"
      },
      "recommendation": "Keep permission, feedback, and failure behavior explicit at each tool boundary.",
      "localization": {
        "zh-CN": {
          "title": "工具交互控制可核查",
          "pass_claim": "有界审查范围内存在可定位的工具、权限与失败处理证据。",
          "unknown_claim": "有界审查范围不足以静态证明所有工具治理控制。",
          "recommendation": "在每个工具边界明确记录权限、反馈与失败处理行为。"
        }
      }
    },
    {
      "title": "Completion evidence is inspectable",
      "required_categories": [
        "trajectory",
        "verification",
        "feedback"
      ],
      "pass_claim": "Trajectory, verification, and result-feedback evidence are present in the bounded scope.",
      "unknown_claim": "The bounded scope does not prove a complete completion-evidence chain.",
      "impact": {
        "level": "medium"
      },
      "recommendation": "Record a stable link from each completion claim to its verification result.",
      "localization": {
        "zh-CN": {
          "title": "完成证据可核查",
          "pass_claim": "有界审查范围内存在执行轨迹、验证与结果反馈证据。",
          "unknown_claim": "有界审查范围不足以证明完整的任务完成证据链。",
          "recommendation": "为每项完成声明建立指向验证结果的稳定关联。"
        }
      }
    }
  ],
  "flow": {
    "nodes": [
      {
        "label": "Observation",
        "label_zh_cn": "观察",
        "category": "trajectory"
      },
      {
        "label": "Agent",
        "label_zh_cn": "Agent",
        "category": "agent"
      },
      {
        "label": "Tool Call",
        "label_zh_cn": "工具调用",
        "category": "tool"
      },
      {
        "label": "Verification",
        "label_zh_cn": "验证",
        "category": "verification"
      }
    ]
  },
  "runtime": {
    "max_seconds": 900,
    "starts_when": "local_repository_exists_and_dependencies_are_installed",
    "includes": [
      "evidence_collection",
      "rule_analysis",
      "artifact_generation",
      "html_svg_rendering"
    ],
    "excludes": [
      "clone",
      "dependency_install",
      "llm_network",
      "manual_review"
    ]
  }
}
